topic,verification,data
you_want_to_change_the_car_component_{{car_component}}._You_are_not_explicit_ind_saying_what_you_want_to_do_with_it._You_will_refine_it_later.,True,ambient lights and seat heat
the_component_of_the_state_change_is_located_in_a_specific_position,True,seat
you_want_to_change_the_state_of_the_{{car_component}}_to_a_state.,True,ambient lights to pearl white; seat heat to high
you_want_to_know_which_functions_you_can_change_in_the_car_via_voice_input,False,
you_want_to_know_the_possible_state_of_car_component_that_is_controllable_via_voice,True,ambient light color and seat heat level
you_want_to_know_the_state_of_a_car_component_that_is_controllable,True,ambient lights were turquoise; seat heat was high
